{
	"$schema": "http://json-schema.org/draft-07/schema#",
	"$id": "https://solstice.local/schema/card.schema.json",
	"title": "Solstice card contract",
	"description": "One card = one coordinate: element (7) x tier (0-9, over, ban) x class (3). Truth: docs/CARDS.md SS5-SS7 and docs/CARDS.md SS1. Read at runtime from game/Config/Solstice/Data/cards.*.json.",
	"type": "object",
	"required": ["cards"],
	"properties": {
		"_comment": { "type": "string" },
		"_note": { "type": "string" },
		"element": {
			"description": "The branch this file carries. Not used at runtime; the per-card field wins.",
			"$ref": "#/definitions/element"
		},
		"cards": {
			"type": "array",
			"items": { "$ref": "#/definitions/card" }
		}
	},
	"definitions": {
		"element": {
			"type": "string",
			"enum": ["metal", "wood", "water", "fire", "earth", "light", "dark"],
			"description": "Seven primal elements, a fixed set (docs/WORLD.md SS1.2)."
		},
		"biText": {
			"description": "Chinese and English travel together; a missing side falls back to the other.",
			"type": "object",
			"properties": {
				"zh": { "type": "string" },
				"en": { "type": "string" }
			},
			"additionalProperties": false
		},
		"tier": {
			"description": "0-9 regular, \"over\" for the over-tier, \"ban\" for the forbidden tier.",
			"oneOf": [
				{ "type": "integer", "minimum": 0, "maximum": 9 },
				{ "type": "string", "enum": ["over", "ban"] }
			]
		},
		"card": {
			"type": "object",
			"required": ["id", "name", "element", "tier", "class", "duration", "direction", "scope", "effect"],
			"properties": {
				"id": {
					"type": "string",
					"pattern": "^card\\.[a-z]+\\.[0-9a-z-]+\\.[a-z]+\\.[a-z0-9-]+$",
					"description": "card.<element>.<tier>.<class>.<name>, e.g. card.earth.2.matter.hill"
				},
				"name": { "$ref": "#/definitions/biText" },
				"desc": { "$ref": "#/definitions/biText" },
				"element": { "$ref": "#/definitions/element" },
				"element_aux": {
					"description": "Second tag for multi-element cards. Optional in M0.",
					"$ref": "#/definitions/element"
				},
				"tier": { "$ref": "#/definitions/tier" },
				"class": {
					"description": "What the card is in the world (docs/CARDS.md SS4).",
					"type": "string",
					"enum": ["matter", "rite", "law"]
				},
				"duration": {
					"description": "Persistence (docs/CARDS.md SS6).",
					"type": "string",
					"enum": ["instant", "sustain", "permanent", "trigger"]
				},
				"direction": {
					"type": "string",
					"enum": ["create", "remove", "transform"]
				},
				"scope": {
					"type": "string",
					"enum": ["global", "area", "single", "brush"]
				},
				"effect": {
					"description": "The concrete simulated effect the kernel runs (EEffect in SolsticeTypes.h).",
					"type": "string",
					"enum": [
						"raise", "lower", "flatten", "ridge", "paint", "ignite",
						"heat", "chill", "water", "ore", "seed-life", "record",
						"erode", "weather", "none"
					]
				},
				"provisional": {
					"description": "True when the slot exists for playability but its effect / params / animation / visible feedback are not yet authored per card (docs/CARDS.md SS3).",
					"type": "boolean",
					"default": false
				},
				"params": {
					"description": "Effect parameters, written in data-side names. SolsticeDataLoader.cpp ReadParams translates material / species / weather to kernel indices; the kernel reads 'mat', which is the translated index - never write 'mat' in data. Numeric keys: radius, peak, delta_temp, water_delta, strength, count, humidity, cloud. Names: material (ParseMaterial), species (ParseSpeciesKind, first used at M1), weather (ParseWeather names).",
					"type": "object",
					"properties": {
						"radius": { "type": "number" },
						"peak": { "type": "number" },
						"delta_temp": { "type": "number" },
						"water_delta": { "type": "number" },
						"strength": { "type": "number" },
						"count": { "type": "integer", "minimum": 1 },
						"humidity": { "type": "number" },
						"cloud": { "type": "number" },
						"material": {
							"type": "string",
							"enum": ["soil", "clay", "mud", "stone", "ore", "deadwood", "plant", "water", "magma", "ice", "snow", "sand", "ash", "tissue"]
						},
						"species": {
							"description": "Species kind name (ParseSpeciesKind in SolsticeDataLoader.cpp).",
							"type": "string"
						},
						"weather": {
							"type": "string",
							"enum": ["clear", "cloudy", "rain", "storm", "fog"]
						}
					},
					"additionalProperties": false
				}
			},
			"additionalProperties": false
		}
	}
}
