{
	"_comment": "Solstice M0 card data - earth branch. Contract: shared/schema/card.schema.json. Names come from docs/CARDS.md SS3.1 (M0 first ten candidates) plus provisional M0 grid slots.",
	"_note": "provisional=true means: this slot is written for playability so the M0 grid is complete, while its effect / params / animation / visible feedback have NOT yet been authored per card (CARD-LIST SS3 definition). Authoring order follows P1-P4 need.",
	"element": "earth",
	"cards": [
		{
			"id": "card.earth.0.matter.pinched-earth",
			"name": { "zh": "碎土一片", "en": "Pinched Earth" },
			"desc": { "zh": "拈起的一撮土，落在纸上就成了一小片地。零环碎片：放下即散尽，不留回响。", "en": "A pinch of earth. Dropped on the paper it becomes a small patch of ground. A tier-0 shard: it is spent on release and leaves no echo." },
			"element": "earth",
			"tier": 0,
			"class": "matter",
			"duration": "instant",
			"direction": "create",
			"scope": "single",
			"effect": "paint",
			"provisional": false,
			"params": { "radius": 1.6, "material": "soil" }
		},
		{
			"id": "card.earth.0.rite.dust-sift",
			"name": { "zh": "筛土", "en": "Sift Dust" },
			"desc": { "zh": "把一层细土从指缝里筛下去，薄薄地铺满一小块。", "en": "Sift a layer of fine soil through your fingers to dust a small area." },
			"element": "earth",
			"tier": 0,
			"class": "rite",
			"duration": "instant",
			"direction": "transform",
			"scope": "area",
			"effect": "paint",
			"provisional": true,
			"params": { "radius": 2.2, "material": "sand" }
		},
		{
			"id": "card.earth.0.law.firm-ground",
			"name": { "zh": "微固", "en": "Firm Ground" },
			"desc": { "zh": "一小片地面记住自己该是平的。", "en": "A small patch of ground remembers it should be flat." },
			"element": "earth",
			"tier": 0,
			"class": "law",
			"duration": "sustain",
			"direction": "transform",
			"scope": "area",
			"effect": "flatten",
			"provisional": true,
			"params": { "radius": 2.5 }
		},
		{
			"id": "card.earth.1.matter.mound",
			"name": { "zh": "土丘", "en": "Mound" },
			"desc": { "zh": "半径三米的土丘，峰高两米。永久。", "en": "A mound three metres across, two metres at its crown. Permanent." },
			"element": "earth",
			"tier": 1,
			"class": "matter",
			"duration": "permanent",
			"direction": "create",
			"scope": "area",
			"effect": "raise",
			"provisional": false,
			"params": { "radius": 3.0, "peak": 2.0 }
		},
		{
			"id": "card.earth.1.rite.lift",
			"name": { "zh": "抬升", "en": "Lift" },
			"desc": { "zh": "笔刷扫过的地面整体抬高，纸层被顶起来。", "en": "The brushed ground is pushed up as a whole, lifting the paper layers." },
			"element": "earth",
			"tier": 1,
			"class": "rite",
			"duration": "instant",
			"direction": "transform",
			"scope": "brush",
			"effect": "raise",
			"provisional": false,
			"params": { "radius": 4.0, "peak": 3.0 }
		},
		{
			"id": "card.earth.1.law.settle-slope",
			"name": { "zh": "定坡", "en": "Settle Slope" },
			"desc": { "zh": "一片地面从此不再塌、不再滑，坡度被写死。", "en": "A patch of ground will no longer slump or slide; its slope is written down." },
			"element": "earth",
			"tier": 1,
			"class": "law",
			"duration": "permanent",
			"direction": "transform",
			"scope": "area",
			"effect": "erode",
			"provisional": true,
			"params": { "radius": 4.0 }
		},
		{
			"id": "card.earth.2.matter.hill",
			"name": { "zh": "丘陵", "en": "Hill" },
			"desc": { "zh": "半径八米、峰高六米的丘陵。一层纸叠成一座小丘。", "en": "A hill eight metres across and six metres high: one sheet folded into a rise." },
			"element": "earth",
			"tier": 2,
			"class": "matter",
			"duration": "permanent",
			"direction": "create",
			"scope": "area",
			"effect": "raise",
			"provisional": false,
			"params": { "radius": 8.0, "peak": 6.0 }
		},
		{
			"id": "card.earth.2.rite.sink-hollow",
			"name": { "zh": "下陷", "en": "Sink Hollow" },
			"desc": { "zh": "指腹按下去，纸面凹出一个浅坑。", "en": "Press with a fingertip and the paper gives way into a shallow hollow." },
			"element": "earth",
			"tier": 2,
			"class": "rite",
			"duration": "instant",
			"direction": "transform",
			"scope": "area",
			"effect": "lower",
			"provisional": true,
			"params": { "radius": 6.0, "peak": 3.0 }
		},
		{
			"id": "card.earth.2.law.terrace-keep",
			"name": { "zh": "台地律", "en": "Law of Terraces" },
			"desc": { "zh": "这一片只许以纸板的方式存在：高的地方刮平，低的地方垫平。", "en": "This ground may only exist as stacked boards: high places are scraped flat, low places filled." },
			"element": "earth",
			"tier": 2,
			"class": "law",
			"duration": "sustain",
			"direction": "transform",
			"scope": "area",
			"effect": "flatten",
			"provisional": true,
			"params": { "radius": 8.0 }
		},
		{
			"id": "card.earth.3.matter.ridge",
			"name": { "zh": "山脊", "en": "Ridge" },
			"desc": { "zh": "沿笔刷方向隆起一道山脊，把界切成两半。", "en": "A ridge rises along the brush and cuts the realm in two." },
			"element": "earth",
			"tier": 3,
			"class": "matter",
			"duration": "permanent",
			"direction": "create",
			"scope": "brush",
			"effect": "ridge",
			"provisional": false,
			"params": { "radius": 10.0, "peak": 5.0 }
		},
		{
			"id": "card.earth.3.rite.carve-canyon",
			"name": { "zh": "切谷", "en": "Carve Canyon" },
			"desc": { "zh": "从一处下切，撕开一道深缝，纸的断面露出来。", "en": "Cut down from one point and tear open a deep seam; the paper's cross-section shows." },
			"element": "earth",
			"tier": 3,
			"class": "rite",
			"duration": "instant",
			"direction": "remove",
			"scope": "brush",
			"effect": "lower",
			"provisional": true,
			"params": { "radius": 5.0, "peak": 7.0 }
		},
		{
			"id": "card.earth.3.law.strata-order",
			"name": { "zh": "层理律", "en": "Law of Strata" },
			"desc": { "zh": "整个界按层叠的方式重新排布：高处被削，低处被填，直到每层都咬得严丝合缝。", "en": "The whole realm is re-stacked: peaks shaved, hollows filled, until every layer sits flush." },
			"element": "earth",
			"tier": 3,
			"class": "law",
			"duration": "permanent",
			"direction": "transform",
			"scope": "global",
			"effect": "erode",
			"provisional": true,
			"params": { "radius": 24.0 }
		}
	]
}
