{
	"_comment": "Solstice M0 card data - fire branch. Contract: shared/schema/card.schema.json. Names come from docs/CARDS.md SS3.1 (M0 first ten candidates) plus provisional M0 grid slots.",
	"_note": "provisional=true means: this slot is written for playability so the M0 grid is complete, while its effect / params / animation / visible feedback have NOT yet been authored per card (CARD-LIST SS3 definition). Authoring order follows P1-P4 need.",
	"element": "fire",
	"cards": [
		{
			"id": "card.fire.0.matter.spark-ember",
			"name": { "zh": "火星一粒", "en": "A Single Spark" },
			"desc": { "zh": "一粒火星落在纸上，亮一下就没了。零环碎片，暗夜里最好看。", "en": "One spark lands on the paper, glows, and is gone. A tier-0 shard, at its best in the dark." },
			"element": "fire",
			"tier": 0,
			"class": "matter",
			"duration": "instant",
			"direction": "create",
			"scope": "single",
			"effect": "heat",
			"provisional": false,
			"params": { "radius": 1.5, "delta_temp": 6.0 }
		},
		{
			"id": "card.fire.0.rite.warm-palm",
			"name": { "zh": "温掌", "en": "Warm Palm" },
			"desc": { "zh": "手心按在纸面上，那一小块就暖了。", "en": "Press a palm to the paper and that small patch warms." },
			"element": "fire",
			"tier": 0,
			"class": "rite",
			"duration": "instant",
			"direction": "transform",
			"scope": "single",
			"effect": "heat",
			"provisional": true,
			"params": { "radius": 2.0, "delta_temp": 4.0 }
		},
		{
			"id": "card.fire.0.law.ember-keep",
			"name": { "zh": "留烬", "en": "Keep the Ember" },
			"desc": { "zh": "这一小片会一直比周围暖一点，像刚被人离开。", "en": "This little patch stays a little warmer than its surroundings, as if someone just left." },
			"element": "fire",
			"tier": 0,
			"class": "law",
			"duration": "sustain",
			"direction": "transform",
			"scope": "single",
			"effect": "heat",
			"provisional": true,
			"params": { "radius": 2.5, "delta_temp": 8.0 }
		},
		{
			"id": "card.fire.1.matter.brazier",
			"name": { "zh": "火盆", "en": "Brazier" },
			"desc": { "zh": "一具小小的火盆。只要下面还有东西可烧，它就不灭。", "en": "A small brazier. It keeps burning as long as there is something beneath it to burn." },
			"element": "fire",
			"tier": 1,
			"class": "matter",
			"duration": "permanent",
			"direction": "create",
			"scope": "single",
			"effect": "ignite",
			"provisional": true,
			"params": { "radius": 1.5 }
		},
		{
			"id": "card.fire.1.rite.spark",
			"name": { "zh": "火种", "en": "Kindling" },
			"desc": { "zh": "落点要有可燃物才点得着；纸是烧得起来的。", "en": "It only catches if the landing spot has something to burn, and paper burns." },
			"element": "fire",
			"tier": 1,
			"class": "rite",
			"duration": "instant",
			"direction": "create",
			"scope": "single",
			"effect": "ignite",
			"provisional": false,
			"params": { "radius": 1.0 }
		},
		{
			"id": "card.fire.1.law.dry-season",
			"name": { "zh": "燥木律", "en": "Law of Dry Wood" },
			"desc": { "zh": "这一片从此不容易留住水，火走过的地方会更容易再着。", "en": "This ground no longer holds water well, and where fire has passed it catches more easily." },
			"element": "fire",
			"tier": 1,
			"class": "law",
			"duration": "sustain",
			"direction": "transform",
			"scope": "area",
			"effect": "heat",
			"provisional": true,
			"params": { "radius": 5.0, "delta_temp": 5.0 }
		},
		{
			"id": "card.fire.2.matter.bonfire",
			"name": { "zh": "篝火", "en": "Bonfire" },
			"desc": { "zh": "一堆火。它是这一片夜里唯一的亮点，也是最早把纸烧黑的东西。", "en": "A pile of fire: the only bright thing at night, and the first thing that blackens the paper." },
			"element": "fire",
			"tier": 2,
			"class": "matter",
			"duration": "permanent",
			"direction": "create",
			"scope": "area",
			"effect": "ignite",
			"provisional": true,
			"params": { "radius": 3.0 }
		},
		{
			"id": "card.fire.2.rite.heat-haze",
			"name": { "zh": "热浪", "en": "Heat Haze" },
			"desc": { "zh": "区域内气温上升八度；可以用降温把它改回去。", "en": "Air temperature in the area rises by eight degrees; a chill card can put it back." },
			"element": "fire",
			"tier": 2,
			"class": "rite",
			"duration": "sustain",
			"direction": "transform",
			"scope": "area",
			"effect": "heat",
			"provisional": false,
			"params": { "radius": 6.0, "delta_temp": 8.0 }
		},
		{
			"id": "card.fire.2.law.wind-fan",
			"name": { "zh": "风助律", "en": "Law of the Fanning Wind" },
			"desc": { "zh": "这一片的天更愿意起云、更快落雨，火跑得也更快。", "en": "The sky over this ground clouds sooner and rains sooner; fire runs faster too." },
			"element": "fire",
			"tier": 2,
			"class": "law",
			"duration": "sustain",
			"direction": "transform",
			"scope": "area",
			"effect": "weather",
			"provisional": true,
			"params": { "strength": 0.5, "humidity": 0.4, "cloud": 0.7, "weather": "cloudy" }
		},
		{
			"id": "card.fire.3.matter.magma-vent",
			"name": { "zh": "岩浆口", "en": "Magma Vent" },
			"desc": { "zh": "地面裂开一处，底下是烧红的纸浆。它自己会一直热下去。", "en": "The ground opens; beneath it the paper pulp is glowing. It will keep itself hot." },
			"element": "fire",
			"tier": 3,
			"class": "matter",
			"duration": "permanent",
			"direction": "create",
			"scope": "single",
			"effect": "paint",
			"provisional": true,
			"params": { "radius": 2.0, "material": "magma" }
		},
		{
			"id": "card.fire.3.rite.conflagration",
			"name": { "zh": "焚原", "en": "Conflagration" },
			"desc": { "zh": "一片原野同时点着。烧过的纸会留下灰，灰会变成地力。", "en": "A whole plain catches at once. Burnt paper leaves ash, and ash becomes fertility." },
			"element": "fire",
			"tier": 3,
			"class": "rite",
			"duration": "instant",
			"direction": "transform",
			"scope": "area",
			"effect": "ignite",
			"provisional": true,
			"params": { "radius": 10.0 }
		},
		{
			"id": "card.fire.3.law.ash-return",
			"name": { "zh": "灰归律", "en": "Law of Ash Return" },
			"desc": { "zh": "整个界从此记着：烧掉的东西要还回来。火过之处铺一层灰。", "en": "The realm now remembers: what burns must come back. A layer of ash is spread where fire has passed." },
			"element": "fire",
			"tier": 3,
			"class": "law",
			"duration": "permanent",
			"direction": "create",
			"scope": "global",
			"effect": "paint",
			"provisional": true,
			"params": { "radius": 22.0, "material": "ash" }
		}
	]
}
