{
	"_comment": "Solstice M0 card data - metal branch. Contract: shared/schema/card.schema.json. Names come from docs/CARDS.md SS3.1 (M0 first ten candidates) plus provisional M0 grid slots.",
	"_note": "provisional=true means: this slot is written for playability so the M0 grid is complete, while its effect / params / animation / visible feedback have NOT yet been authored per card (CARD-LIST SS3 definition). Authoring order follows P1-P4 need.",
	"element": "metal",
	"cards": [
		{
			"id": "card.metal.0.matter.gold-dust",
			"name": { "zh": "金屑一片", "en": "Gold Dust" },
			"desc": { "zh": "一撮金屑撒在纸面上，只是把那一格的反照率抬了一点点。", "en": "A pinch of gold dust scattered on the paper: it only lifts the albedo of that one tile." },
			"element": "metal",
			"tier": 0,
			"class": "matter",
			"duration": "instant",
			"direction": "create",
			"scope": "single",
			"effect": "paint",
			"provisional": false,
			"params": { "radius": 1.4, "material": "ore" }
		},
		{
			"id": "card.metal.0.rite.gleam",
			"name": { "zh": "微光", "en": "Gleam" },
			"desc": { "zh": "抬手一照，纸面泛出一点金属的冷白。", "en": "Tilt a hand and the paper returns a cold metallic white." },
			"element": "metal",
			"tier": 0,
			"class": "rite",
			"duration": "instant",
			"direction": "transform",
			"scope": "single",
			"effect": "paint",
			"provisional": true,
			"params": { "radius": 2.0, "material": "stone" }
		},
		{
			"id": "card.metal.0.law.thin-toll",
			"name": { "zh": "薄税", "en": "Thin Toll" },
			"desc": { "zh": "这一小片从此会自己析出一点点矿，很慢，但一直在。", "en": "This small patch now leaches a little ore of its own: slowly, but always." },
			"element": "metal",
			"tier": 0,
			"class": "law",
			"duration": "sustain",
			"direction": "create",
			"scope": "single",
			"effect": "ore",
			"provisional": true,
			"params": { "radius": 3.0 }
		},
		{
			"id": "card.metal.1.matter.vein-outcrop",
			"name": { "zh": "矿脉露头", "en": "Vein Outcrop" },
			"desc": { "zh": "岩芯顶出一段矿脉条带，土生金的第一张看得见的卡。", "en": "A rock core pushes up a banded vein: the first visible step of earth bearing metal." },
			"element": "metal",
			"tier": 1,
			"class": "matter",
			"duration": "permanent",
			"direction": "create",
			"scope": "brush",
			"effect": "ore",
			"provisional": false,
			"params": { "radius": 6.0 }
		},
		{
			"id": "card.metal.1.rite.smelt",
			"name": { "zh": "冶炼", "en": "Smelt" },
			"desc": { "zh": "把落点那一小段岩石重写成矿，石头变沉、变冷。", "en": "Rewrite a short run of rock at the landing spot into ore: heavier, colder." },
			"element": "metal",
			"tier": 1,
			"class": "rite",
			"duration": "instant",
			"direction": "transform",
			"scope": "single",
			"effect": "ore",
			"provisional": true,
			"params": { "radius": 3.0 }
		},
		{
			"id": "card.metal.1.law.chronicle-pillar",
			"name": { "zh": "纪年柱", "en": "Chronicle Pillar" },
			"desc": { "zh": "立一根柱子，把这一刻写进年表。世界会记得你在这里做过什么。", "en": "Raise a pillar and write this moment into the chronicle. The world will remember what you did here." },
			"element": "metal",
			"tier": 1,
			"class": "law",
			"duration": "permanent",
			"direction": "create",
			"scope": "single",
			"effect": "record",
			"provisional": false,
			"params": {}
		},
		{
			"id": "card.metal.2.matter.ore-boulder",
			"name": { "zh": "矿石", "en": "Ore Boulder" },
			"desc": { "zh": "一块沉甸甸的矿石压在纸上，四周的地力被它吸走一点。", "en": "A heavy ore boulder presses on the paper and draws a little fertility out of the ground around it." },
			"element": "metal",
			"tier": 2,
			"class": "matter",
			"duration": "permanent",
			"direction": "create",
			"scope": "brush",
			"effect": "ore",
			"provisional": true,
			"params": { "radius": 8.0 }
		},
		{
			"id": "card.metal.2.rite.quarry",
			"name": { "zh": "采石", "en": "Quarry" },
			"desc": { "zh": "挖开一层，断面露出矿线。挖出来的地方矮下去一点。", "en": "Cut a layer open and the seam shows in cross-section. The cut ground sits a little lower." },
			"element": "metal",
			"tier": 2,
			"class": "rite",
			"duration": "instant",
			"direction": "transform",
			"scope": "area",
			"effect": "lower",
			"provisional": true,
			"params": { "radius": 5.0, "peak": 2.0 }
		},
		{
			"id": "card.metal.2.law.hardness",
			"name": { "zh": "硬度律", "en": "Law of Hardness" },
			"desc": { "zh": "这一片表面不再被风雨磨平，棱角会一直在。", "en": "This surface will not be worn smooth by wind and rain; its edges stay." },
			"element": "metal",
			"tier": 2,
			"class": "law",
			"duration": "permanent",
			"direction": "transform",
			"scope": "area",
			"effect": "erode",
			"provisional": true,
			"params": { "radius": 5.0 }
		},
		{
			"id": "card.metal.3.matter.iron-spire",
			"name": { "zh": "铁塔", "en": "Iron Spire" },
			"desc": { "zh": "一座细高的铁塔从纸里长出来，界里从此有了竖直的东西。", "en": "A thin iron spire grows out of the paper: the realm now has something vertical in it." },
			"element": "metal",
			"tier": 3,
			"class": "matter",
			"duration": "permanent",
			"direction": "create",
			"scope": "brush",
			"effect": "ridge",
			"provisional": true,
			"params": { "radius": 6.0, "peak": 9.0 }
		},
		{
			"id": "card.metal.3.rite.fold",
			"name": { "zh": "折叠", "en": "Fold" },
			"desc": { "zh": "把地块对折一次，折痕自己就成了一道山脊。", "en": "Fold the ground once, and the crease becomes a ridge on its own." },
			"element": "metal",
			"tier": 3,
			"class": "rite",
			"duration": "instant",
			"direction": "transform",
			"scope": "brush",
			"effect": "ridge",
			"provisional": true,
			"params": { "radius": 8.0, "peak": 4.0 }
		},
		{
			"id": "card.metal.3.law.weight",
			"name": { "zh": "承重律", "en": "Law of Load" },
			"desc": { "zh": "整个界的纸板都不许再塌下去：低于水面的地方被垫到水面以上。", "en": "No board in the realm may sag again: whatever sits below the water line is shimmed up above it." },
			"element": "metal",
			"tier": 3,
			"class": "law",
			"duration": "permanent",
			"direction": "transform",
			"scope": "global",
			"effect": "water",
			"provisional": true,
			"params": { "water_delta": -2.0 }
		}
	]
}
